{
  "id": "profile.implementation_control",
  "name": "Implementation Control",
  "version": "0.1.0",
  "description": "Profile for governed implementation workflows that separate baselines, projections, reviews, evidence, proposals, approval gates and controlled updates.",
  "allowed_object_kinds": [
    "implementation_baseline",
    "projection_view",
    "semantic_review",
    "workflow_batch",
    "implementation_cycle",
    "launch_record",
    "process_control_contract",
    "process_transition_request",
    "process_transition_result",
    "technology_contract",
    "technology_quality_feedback",
    "quality_finding",
    "development_cockpit",
    "cockpit_instrument",
    "feature_implementation_trace",
    "implementation_mapping",
    "multi_source_quality_feedback",
    "feedback_source",
    "kaizen_review",
    "graph_dna",
    "component_dna",
    "dna_alignment",
    "source_boundary_contract",
    "source_boundary",
    "work_state_machine",
    "work_state",
    "recovery_record",
    "risk_control",
    "agent_reservation",
    "coordination_contract",
    "evidence_pack",
    "sync_proposal",
    "launch_gate",
    "approval_gate",
    "controlled_update",
    "implementation_state",
    "drift_check",
    "validator",
    "risk",
    "blocker",
    "review",
    "release_gate",
    "kaizen_item",
    "evidence",
    "regression_case",
    "lesson"
  ],
  "allowed_relation_types": [
    "derives_projection",
    "reviews_projection",
    "produces_evidence",
    "proposes_update",
    "requires_gate",
    "launches_batch",
    "requires_launch_record",
    "checks_transition",
    "checks_conformance_to",
    "classifies",
    "routes_to",
    "requires_technology_feedback",
    "measures",
    "traces_implementation",
    "aggregates_feedback",
    "calibrates_transition",
    "requires_kaizen_closure",
    "approves_update",
    "updates_baseline",
    "checks_drift",
    "validates_cycle",
    "progresses_to",
    "promotes_feedback",
    "aligns_with",
    "owns_scope",
    "excludes_scope",
    "defines_boundary",
    "transitions_to",
    "resumes_from",
    "controls_risk",
    "reserves_scope",
    "coordinates_with",
    "blocks",
    "mitigates",
    "records_state",
    "requires_review",
    "requires_release_gate",
    "improves_process",
    "evidences",
    "related_to"
  ],
  "default_readiness": "draft",
  "governance_gates": [
    "semantic_review_before_sync_proposal",
    "evidence_pack_before_approval",
    "approval_before_canonical_update",
    "launch_gate_before_work_batch",
    "drift_check_before_state_promotion",
    "technology_quality_feedback_before_acceptance",
    "public_safety_before_public_transfer",
    "no_generated_context_as_authorization",
    "no_feedback_as_automatic_update"
  ]
}
